1-7154858,3,2018-05-03 19:28,1830 PSS-32,France Telecom Espana SA, ,chernanz,chernanz,2019-01-21 15:36,chernanz,2019-03-08 22:30,Alarmas sobre canales OPR en la estructura 427VITO VITO,Pendiente posible rediseño.
1-7151840,1,2018-05-01 01:46,1830 PSS-64,SUPERONLINE,No Selection,nkilicas,nkilicas,2019-01-25 19:07,ssikoglu,2018-07-06 08:06,Ekli mailde bilgiler var. SILKNET devremiz kesik acil inceler misiniz?,Awaiting Customer Maintenance Window
1-7142040,3,2018-04-20 10:53,1830 PSS-32,OPT New Caledonia,No Selection,shivs,shivs,2019-01-21 17:04,shivs,2019-02-28 23:50,Problem summary:- LAG 1/16/1 the value of LKO-R-1 Actor System Priority is 0 and on LAG 1/17/1 the same parameter has a value of 32768.,Solution provided with Red to old Ref AR#1-6937476.
1-7125527,3,2018-04-05 21:54,1830 PSS-32,Shaw Cablesystems G.P.,No Selection,mlanctot,mlanctot,2019-01-16 02:23,mlanctot,2019-03-09 03:30,1830 Radius should support accounting,Local team needs to contact PLM
1-7116292,1,2018-03-27 22:55,1830 PSS-32,SUPERONLINE,No Selection,gmehdipu,gmehdipu,2018-10-26 13:26,mozgur,2018-04-30 02:30,Control Card redundancy is compromised,RCA has shared with customer
1-7102979,3,2018-03-15 12:14,1830 PSS-32,Telefonica de Espana,TELEFONICA MADRID JULIAN CAMARILLO,martama,martama,2019-01-30 21:03,fserrano,2019-09-10 19:23,Alarma Itermitente en M.SM TR01:TNOW1830 PSS:1,Las alarmas de OPR de este canal son debidas a la planicidad del amplificador 3-3 AHPLG. Se recomienda auditoría y rediseño.
1-7091849,3,2018-03-06 19:31,1830 PSS-32,Alcatel-Lucent,No Selection,sadmi1,sadmi1,2018-03-22 19:28,sadmi1,2018-03-31 03:30,Issues during upgrade,la carte EC 1/18 n'est pas joignable en IP merci de la remplacer
1-7040536,3,2018-01-18 13:26,1830 PSS-36,MTS PJSC,No Selection,aonokhin,aonokhin,2019-01-30 13:35,aonokhin,2019-02-08 13:30,"On 12 elements of PSS36 hangs an alarm ""FilterClogged"". Filter cleaning is carried out regularly, most recently in December 2017. I ask for recommendations.",18-Jan: awaiting upgrade to R10.0.5 finishing (planned on Jan-Feb). Pending confirmed.
1-7024656,2,2018-01-05 03:19,1830 PSS-32,Comcast Corporation,San Mateo CA - 83 East 21st,mlanctot,mlanctot,2019-01-28 20:55,mlanctot,2019-03-30 02:30,Commands sent from OMS do not appear to be logged on NE,Under consideration
1-7006458,3,2017-12-14 18:10,1830 PSS-32,Telefonica de Espana,"Madrid ES - Calle De Torrelara, 6, 1º",rodiazna,rodiazna,2019-01-11 19:31,martama,2019-10-26 12:41,Vano degradado entre ILA 19 y Sede Cliente.,"Se sigue en monitorización. La degradación tiene picos de caídas de hata 7 dBs, pero sigue estable."
1-6988352,4,2017-11-29 13:14,1830 PSS-4,Telefonica de Espana, ,anblanco,anblanco,2018-10-29 21:22,martama,2018-10-30 16:30,Origen de las Alarmas Externas,Se ha cambiado el parámetro SNMP Source a LoopbackIp Only en todos lod PSS4 GNEs. Pendiente desconfigurar y volver a configurar las alarmas de HouseKeeping en el nodo de CRIA.
1-6953979,2,2017-10-30 18:55,1830 PSS-32,Alcatel-Lucent, ,aismaiel,aismaiel,2019-01-18 00:46,najam,2019-01-28 14:30,This AR opened to get a procedure to upgarde the affected CFs under ON 17-0062b,Information/Action Requested
1-6924828,3,2017-10-05 06:41,1830 PSS-16,Tiscali S.p.A,No Selection,gfalasca,gfalasca,2018-04-04 17:22,gfalasca,2018-12-05 07:41,[ISU_PSS] NE028-VR-POP 1/8 AHPLG fuse failure,car 1/8 still not replaced by customer - II update
1-6923513,3,2017-10-04 06:46,1830 PSS-16,Tiscali S.p.A,No Selection,gfalasca,gfalasca,2018-04-04 17:13,gfalasca,2018-12-04 07:46,[ISU_PSS] NE025-RE-POP 1/3 AHPHG fuse failure,pack 1/3 still not replaced by customer - II update
1-6854961,2,2017-08-04 14:35,1830 PSS-32,France Telecom Espana SA,ORANGE CML ERP MADRID,chernanz,chernanz,2019-01-21 15:36,chernanz,2019-03-08 21:30,Degradación - Martorel 354-400 HOSP BARC WDM.,Se esta revisando la estructura por NI.
1-6838409,2,2017-07-20 21:38,1830 PSS-36,Emirates Integrated Telecommunications Company,EITC,shadyi,shadyi,2019-01-27 23:35,shadyi,2019-03-25 21:30,"EITC Network is affected with 17-0572-ON-OCS-1830 ""PSS-64-36_100G_or_40G cards might enter in SWDL in R9""","27/01/2019 Fix is included on R9.1.4 and follow, A plan to Upgrade the NEs to R11.0.x is currently on going . 17-3-2018 - Waiting Network Upgrade to R9.1.x"
1-6687855,1,2017-03-16 22:11,1830 PSS-32,Telefonica de Espana,TELEFONICA-SEVILLA-SAN BERNARDO C. T,martama,martama,2019-01-15 18:03,martama,2019-12-14 16:26,Fallo en Plano de Control en equipos S.SB-OAD1830WSS-1 8/3/2017 19:36H de Malla Fotonica Regional,A partir de la release R 10 se soluciona el problema. Pendiente migración.
1-6545397,4,2016-11-23 17:18,1830 PSS-36,Telefonica de Espana,No Selection,martama,martama,2018-10-25 19:46,martama,2019-09-12 21:25,Fallo de las unidades 130SCUP,Se informa de cada uno de los fallos estudiados y se continua con el seguimiento con TEC y R&D de cualquier nuevo caso.
